LGK0015	n/a	Kohls	n/a	n/a	n/a	n/a	n/a	http://www.kohls.com/product/prd-1130257/wildkin-olive-kids-mermaid-pack-n-snack-backpack-kids.jsp?searchTerm=Wildkin%20Olive%20Kids%20Mermaids%20Pack%20n%20Snack%20Blackpack	Wildkin	Wildkin Olive Kids Mermaid Pack 'n Snack Backpack - Kids	1130257	1130257	29.99	12/2/2013 14:37	Wildkin Olive Kids Mermaid Pack 'n Snack Backpack - Kids	n/a	n/a	"<li > <a href=""#collection-content"" class=""active""> Product Details </a> </li> </ul> <div id=""collection-content""> <div class=""prod_description1""> <div class=""Bdescription""> <p>This girls' Wildkin backpack doubles as a lunch bag with an insulated food-safe compartment. In blue/multi.</p><p><strong>Product Features</strong></p> <ul> <li>Moisture-resistant lining</li> <li>Mesh side pocket</li> <li>Reflective tape accents front</li> <li>Shell features 600-<a href=""javascript:launch('http://www.kohlscorporation.com/ecom/valueadded/Glossary.htm#denier')"">denier</a> construction</li> </ul> <p><strong>Product Details</strong></p> <ul> <li>12""H x 10""W x 4.5""D</li> <li>Ages 3 years & up</li> <li>Polyester/nylon</li> <li>Zipper closures</li> <li>Manufacturer's one-year limited warranty</li> <li>Model no: 40081</li> </ul> <p><em>Promotional offers available online at Kohls.com may vary from those offered in Kohl's stores.</em></p> </div> </div> </div>"	"Product Details This girls' Wildkin backpack doubles as a lunch bag with an insulated food-safe compartment. In blue/multi.Product Features Moisture-resistant lining Mesh side pocket Reflective tape accents front Shell features 600-denier construction Product Details 12""H x 10""W x 4.5""D Ages 3 years & up Polyester/nylon Zipper closures Manufacturer's one-year limited warranty Model no: 40081 Promotional offers available online at Kohls.com may vary from those offered in Kohl's stores."	n/a	n/a	n/a	n/a	http://media.kohls.com.edgesuite.net/is/image/kohls/1130257?wid=350&hei=350&op_sharpen=1	n/a	n/a	N	n/a	n/a	n/a	n/a	n/a	n/a	n/a	n/a	n/a	n/a	n/a	n/a	n/a	n/a	n/a	n/a	n/a	n/a	n/a	n/a	n/a	n/a	n/a	n/a	n/a	n/a	29.99	n/a	n/a	Yes	n/a	n/a	n/a	n/a	n/a	97277400817	n/a	n/a	n/a	n/a	n/a	n/a	n/a	n/a
LGK0014	n/a	Kohls	n/a	n/a	n/a	n/a	n/a	http://www.kohls.com/product/prd-1130256/wildkin-olive-kids-wild-animals-pack-n-snack-backpack-kids.jsp	Wildkin	Wildkin Olive Kids Wild Animals Pack 'n Snack Backpack - Kids	1130256	1130256	25.99	12/2/2013 14:37	Wildkin Olive Kids Wild Animals Pack 'n Snack Backpack - Kids	n/a	n/a	"<li > <a href=""#collection-content"" class=""active""> Product Details </a> </li> </ul> <div id=""collection-content""> <div class=""prod_description1""> <div class=""Bdescription""> <p>This kids' Wildkin backpack doubles as a lunch bag with an insulated food-safe compartment. In green/multi.</p><p><strong>Product Features</strong></p> <ul> <li>Moisture-resistant lining</li> <li>Mesh side pocket</li> <li>Reflective tape accents front</li> <li>Shell features 600-<a href=""javascript:launch('http://www.kohlscorporation.com/ecom/valueadded/Glossary.htm#denier')"">denier</a> construction</li> <li>Zipper closures</li> </ul> <p><strong>Product Details</strong></p> <ul> <li>12""H x 10""W x 4.5""D</li> <li>Ages 3 years & up</li> <li>Polyester/nylon</li> <li>Manufacturer's one-year limited warranty</li> <li>Model no<strong>: </strong>40080</li> </ul> <p><em>Promotional offers available online at Kohls.com may vary from those offered in Kohl's stores.</em></p> </div> </div> </div>"	"Product Details This kids' Wildkin backpack doubles as a lunch bag with an insulated food-safe compartment. In green/multi.Product Features Moisture-resistant lining Mesh side pocket Reflective tape accents front Shell features 600-denier construction Zipper closures Product Details 12""H x 10""W x 4.5""D Ages 3 years & up Polyester/nylon Manufacturer's one-year limited warranty Model no: 40080 Promotional offers available online at Kohls.com may vary from those offered in Kohl's stores."	n/a	n/a	n/a	n/a	http://media.kohls.com.edgesuite.net/is/image/kohls/1130256?wid=350&hei=350&op_sharpen=1	n/a	n/a	N	n/a	n/a	n/a	n/a	n/a	n/a	n/a	n/a	n/a	n/a	n/a	n/a	n/a	n/a	n/a	n/a	n/a	n/a	n/a	n/a	n/a	n/a	n/a	n/a	n/a	n/a	25.99	n/a	n/a	Yes	n/a	n/a	n/a	n/a	n/a	97277400800	n/a	n/a	n/a	n/a	n/a	n/a	n/a	n/a
LGK0017	n/a	Kohls	n/a	n/a	n/a	n/a	n/a	http://www.kohls.com/product/prd-1130262/wildkin-peace-sign-kickstart-messenger-bag-kids.jsp	Wildkin	Wildkin Peace Sign Kickstart Messenger Bag - Kids	1130262	1130262	36.99	12/2/2013 14:37	Wildkin Peace Sign Kickstart Messenger Bag - Kids	n/a	n/a	"<li > <a href=""#collection-content"" class=""active""> Product Details </a> </li> <li><a class=""rating-content"" onclick=""sc_bvTabOpen()"" href=""#rating-content""> Ratings & Reviews </a></li> </ul> <div id=""collection-content""> <div class=""prod_description1""> <div class=""Bdescription""> <p>A front flap provides a smooth finish on this Wildkin girls' messenger bag, featuring six interior pockets, perfect for phones, pens and papers. In purple.</p><p><strong>Product Features:</strong></p> <ul> <li>Padded shoulder strap adjusts to fit</li> <li>Exterior offers a durable 600-<a href=""javascript:launch('http://www.kohlscorporation.com/ecom/valueadded/Glossary.htm#denier')"">denier</a> construction</li> </ul> <p><strong>Product Details:</strong></p> <ul> <li>10""H x 13""W x 4""D</li> <li>Ages 8 years & up</li> <li>Polyester/nylon</li> <li>Velcro-like closure</li> <li>Manufacturer's one-year limited warranty</li> <li>Model no. 41212</li> </ul> <p><em>Promotional offers available online at Kohls.com may vary from those offered in Kohl's stores.</em></p> </div> </div> </div>"	"Product Details Ratings & Reviews A front flap provides a smooth finish on this Wildkin girls' messenger bag, featuring six interior pockets, perfect for phones, pens and papers. In purple.Product Features: Padded shoulder strap adjusts to fit Exterior offers a durable 600-denier construction Product Details: 10""H x 13""W x 4""D Ages 8 years & up Polyester/nylon Velcro-like closure Manufacturer's one-year limited warranty Model no. 41212 Promotional offers available online at Kohls.com may vary from those offered in Kohl's stores."	n/a	n/a	n/a	Padded shoulder strap adjusts to fit####Exterior offers a durable 600-denier construction	http://media.kohls.com.edgesuite.net/is/image/kohls/1130262?wid=350&hei=350&op_sharpen=1	n/a	n/a	N	n/a	n/a	n/a	n/a	n/a	n/a	"</p> <ul> <li>10""H x 13""W x 4""D</li> <li>Ages 8 years & up</li> <li>Polyester/nylon</li> <li>Velcro-like closure</li> <li>Manufacturer's one-year limited warranty</li> <li>Model no. 41212</li> </ul> <p><em>Promotional offers available online at Kohls.com may vary from those offered in Kohl's stores.</em></p>"	n/a	"10""H x 13""W x 4""D####Ages 8 years & up####Polyester/nylon####Velcro-like closure####Manufacturer's one-year limited warranty####Model no. 41212 Promotional offers available online at Kohls.com may vary from those offered in Kohl's stores."	1	5	0	0	0	0	1	n/a	n/a	n/a	n/a	n/a	n/a	n/a	n/a	n/a	n/a	36.99	n/a	n/a	Yes	n/a	n/a	n/a	n/a	n/a	97277412124	n/a	n/a	n/a	n/a	n/a	n/a	n/a	n/a
LGK0188	n/a	Kohls	n/a	n/a	n/a	n/a	n/a	http://www.kohls.com/product/prd-1130261/wildkin-owl-kickstart-messenger-bag-kids.jsp	Wildkin	Wildkin Owl Kickstart Messenger Bag - Kids	1130261	1130261	36.99	12/2/2013 14:37	Wildkin Owl Kickstart Messenger Bag - Kids	n/a	n/a	"<li > <a href=""#collection-content"" class=""active""> Product Details </a> </li> </ul> <div id=""collection-content""> <div class=""prod_description1""> <div class=""Bdescription""> <p>A front flap provides a smooth finish on this Wildkin girls' messenger bag featuring six interior pockets, perfect for phones, pens and papers. In pink.</p><p><strong>Product Features:</strong></p> <ul> <li>Padded shoulder strap adjusts to fit</li> <li>Exterior offers a durable 600-<a href=""javascript:launch('http://www.kohlscorporation.com/ecom/valueadded/Glossary.htm#denier')"">denier</a> construction</li> </ul> <p><strong>Product Details:</strong></p> <ul> <li>10""H x 13""W x 4""D</li> <li>Ages 8 years & up</li> <li>Polyester/nylon</li> <li>Velcro-like closure</li> <li>Manufacturer's one-year limited warranty</li> <li>Model no. 41211</li> </ul> <p><em>Promotional offers available online at Kohls.com may vary from those offered in Kohl's stores.</em></p> </div> </div> </div>"	"Product Details A front flap provides a smooth finish on this Wildkin girls' messenger bag featuring six interior pockets, perfect for phones, pens and papers. In pink.Product Features: Padded shoulder strap adjusts to fit Exterior offers a durable 600-denier construction Product Details: 10""H x 13""W x 4""D Ages 8 years & up Polyester/nylon Velcro-like closure Manufacturer's one-year limited warranty Model no. 41211 Promotional offers available online at Kohls.com may vary from those offered in Kohl's stores."	n/a	n/a	n/a	Padded shoulder strap adjusts to fit####Exterior offers a durable 600-denier construction	http://media.kohls.com.edgesuite.net/is/image/kohls/1130261?wid=350&hei=350&op_sharpen=1	n/a	n/a	N	n/a	n/a	n/a	n/a	n/a	n/a	"</p> <ul> <li>10""H x 13""W x 4""D</li> <li>Ages 8 years & up</li> <li>Polyester/nylon</li> <li>Velcro-like closure</li> <li>Manufacturer's one-year limited warranty</li> <li>Model no. 41211</li> </ul> <p><em>Promotional offers available online at Kohls.com may vary from those offered in Kohl's stores.</em></p>"	n/a	"10""H x 13""W x 4""D####Ages 8 years & up####Polyester/nylon####Velcro-like closure####Manufacturer's one-year limited warranty####Model no. 41211 Promotional offers available online at Kohls.com may vary from those offered in Kohl's stores."	n/a	n/a	n/a	n/a	n/a	n/a	n/a	n/a	n/a	n/a	n/a	n/a	n/a	n/a	n/a	n/a	n/a	36.99	n/a	n/a	Yes	n/a	n/a	n/a	n/a	n/a	97277412117	n/a	n/a	n/a	n/a	n/a	n/a	n/a	n/a
LGK0187	n/a	Kohls	n/a	n/a	n/a	n/a	n/a	http://www.kohls.com/product/prd-1130260/wildkin-peace-sign-pack-n-snack-backpack-kids.jsp	Wildkin	Wildkin Peace Sign Pack 'n Snack Backpack - Kids	1130260	1130260	29.99	12/2/2013 14:37	Wildkin Peace Sign Pack 'n Snack Backpack - Kids	n/a	n/a	"<li > <a href=""#collection-content"" class=""active""> Product Details </a> </li> </ul> <div id=""collection-content""> <div class=""prod_description1""> <div class=""Bdescription""> <p>This girls' Wildkin backpack doubles as a lunch bag with an insulated food-safe compartment. In purple/multi.</p><p><strong>Product Features</strong></p> <ul> <li>Moisture-resistant lining</li> <li>Mesh side pocket</li> <li>Reflective tape accents front</li> <li>Shell features 600-<a href=""javascript:launch('http://www.kohlscorporation.com/ecom/valueadded/Glossary.htm#denier')"">denier</a> construction</li> </ul> <p><strong>Product Details</strong></p> <ul> <li>12""H x 10""W x 4.5""D</li> <li>Ages 3 years & up</li> <li>Polyester/nylon</li> <li>Zipper closures</li> <li>Manufacturer's one-year limited warranty</li> <li>Model no<strong>:</strong> 40212</li> </ul> <p><em>Promotional offers available online at Kohls.com may vary from those offered in Kohl's stores.</em></p> </div> </div> </div>"	"Product Details This girls' Wildkin backpack doubles as a lunch bag with an insulated food-safe compartment. In purple/multi.Product Features Moisture-resistant lining Mesh side pocket Reflective tape accents front Shell features 600-denier construction Product Details 12""H x 10""W x 4.5""D Ages 3 years & up Polyester/nylon Zipper closures Manufacturer's one-year limited warranty Model no: 40212 Promotional offers available online at Kohls.com may vary from those offered in Kohl's stores."	n/a	n/a	n/a	n/a	http://media.kohls.com.edgesuite.net/is/image/kohls/1130260?wid=350&hei=350&op_sharpen=1	n/a	n/a	N	n/a	n/a	n/a	n/a	n/a	n/a	n/a	n/a	n/a	n/a	n/a	n/a	n/a	n/a	n/a	n/a	n/a	n/a	n/a	n/a	n/a	n/a	n/a	n/a	n/a	n/a	29.99	n/a	n/a	Yes	n/a	n/a	n/a	n/a	n/a	97277402125	n/a	n/a	n/a	n/a	n/a	n/a	n/a	n/a
LGK0186	n/a	Kohls	n/a	n/a	n/a	n/a	n/a	http://www.kohls.com/product/prd-1130259/wildkin-owl-pack-n-snack-backpack-kids.jsp	Wildkin	Wildkin Owl Pack 'n Snack Backpack - Kids	1130259	1130259	29.99	12/2/2013 14:37	Wildkin Owl Pack 'n Snack Backpack - Kids	n/a	n/a	"<li > <a href=""#collection-content"" class=""active""> Product Details </a> </li> </ul> <div id=""collection-content""> <div class=""prod_description1""> <div class=""Bdescription""> <p>This girls' Wildkin backpack doubles as a lunch bag with an insulated food-safe compartment. In pink/multi.</p><p><strong>Product Features</strong></p> <ul> <li>Moisture-resistant lining</li> <li>Mesh side pocket</li> <li>Reflective tape accents front</li> <li>Shell features 600-<a href=""javascript:launch('http://www.kohlscorporation.com/ecom/valueadded/Glossary.htm#denier')"">denier</a> construction</li> </ul> <p><strong>Product Details</strong></p> <ul> <li>12""H x 10""W x 4.5""D</li> <li>Ages 3 years & up</li> <li>Polyester/nylon</li> <li>Zipper closures</li> <li>Manufacturer's one-year limited warranty</li> <li>Model no<strong>:</strong> 40211</li> </ul> <p><em>Promotional offers available online at Kohls.com may vary from those offered in Kohl's stores.</em></p> </div> </div> </div>"	"Product Details This girls' Wildkin backpack doubles as a lunch bag with an insulated food-safe compartment. In pink/multi.Product Features Moisture-resistant lining Mesh side pocket Reflective tape accents front Shell features 600-denier construction Product Details 12""H x 10""W x 4.5""D Ages 3 years & up Polyester/nylon Zipper closures Manufacturer's one-year limited warranty Model no: 40211 Promotional offers available online at Kohls.com may vary from those offered in Kohl's stores."	n/a	n/a	n/a	n/a	http://media.kohls.com.edgesuite.net/is/image/kohls/1130259?wid=350&hei=350&op_sharpen=1	n/a	n/a	N	n/a	n/a	n/a	n/a	n/a	n/a	n/a	n/a	n/a	n/a	n/a	n/a	n/a	n/a	n/a	n/a	n/a	n/a	n/a	n/a	n/a	n/a	n/a	n/a	n/a	n/a	29.99	n/a	n/a	Yes	n/a	n/a	n/a	n/a	n/a	97277402118	n/a	n/a	n/a	n/a	n/a	n/a	n/a	n/a
LGK0197	n/a	Kohls	n/a	n/a	n/a	n/a	n/a	http://www.kohls.com/product/prd-1130504/wildkin-majestic-jumpstart-messenger-bag-kids.jsp	Wildkin	Wildkin Majestic Jumpstart Messenger Bag - Kids	1130504	1130504	36.99	12/2/2013 14:37	Wildkin Majestic Jumpstart Messenger Bag - Kids	n/a	n/a	"<li > <a href=""#collection-content"" class=""active""> Product Details </a> </li> </ul> <div id=""collection-content""> <div class=""prod_description1""> <div class=""Bdescription""> <p>Two interior pockets and two pockets under the front flap of this Wildkin girls' messenger bag keep her organized for class. In pink.</p><p><strong>Product Features:</strong></p> <ul> <li>Moisture-resistant finish lines interior</li> <li>Padded shoulder strap adjusts to fit</li> <li>Exterior offers a durable 600-<a href=""javascript:launch('http://www.kohlscorporation.com/ecom/valueadded/Glossary.htm#denier')"">denier</a> construction</li> </ul> <p><strong>Product Details:</strong></p> <ul> <li>10""H x 15""W x 5""D</li> <li>Ages 8 years & up</li> <li>Polyester/nylon</li> <li>Buckles & Velcro-like closure</li> <li>Manufacturer's one-year limited warranty</li> <li>Model no. 54114</li> </ul> <p><em>Promotional offers available online at Kohls.com may vary from those offered in Kohl's stores.</em></p> </div> </div> </div>"	"Product Details Two interior pockets and two pockets under the front flap of this Wildkin girls' messenger bag keep her organized for class. In pink.Product Features: Moisture-resistant finish lines interior Padded shoulder strap adjusts to fit Exterior offers a durable 600-denier construction Product Details: 10""H x 15""W x 5""D Ages 8 years & up Polyester/nylon Buckles & Velcro-like closure Manufacturer's one-year limited warranty Model no. 54114 Promotional offers available online at Kohls.com may vary from those offered in Kohl's stores."	n/a	n/a	n/a	Moisture-resistant finish lines interior####Padded shoulder strap adjusts to fit####Exterior offers a durable 600-denier construction	http://media.kohls.com.edgesuite.net/is/image/kohls/1130504?wid=350&hei=350&op_sharpen=1	n/a	n/a	N	n/a	n/a	n/a	n/a	n/a	n/a	"</p> <ul> <li>10""H x 15""W x 5""D</li> <li>Ages 8 years & up</li> <li>Polyester/nylon</li> <li>Buckles & Velcro-like closure</li> <li>Manufacturer's one-year limited warranty</li> <li>Model no. 54114</li> </ul> <p><em>Promotional offers available online at Kohls.com may vary from those offered in Kohl's stores.</em></p>"	n/a	"10""H x 15""W x 5""D####Ages 8 years & up####Polyester/nylon####Buckles & Velcro-like closure####Manufacturer's one-year limited warranty####Model no. 54114 Promotional offers available online at Kohls.com may vary from those offered in Kohl's stores."	n/a	n/a	n/a	n/a	n/a	n/a	n/a	n/a	n/a	n/a	n/a	n/a	n/a	n/a	n/a	n/a	n/a	36.99	n/a	n/a	Yes	n/a	n/a	n/a	n/a	n/a	97277541145	n/a	n/a	n/a	n/a	n/a	n/a	n/a	n/a
LGK0195	n/a	Kohls	n/a	n/a	n/a	n/a	n/a	http://www.kohls.com/product/prd-1130498/wildkin-horse-dreams-jumpstart-messenger-bag-kids.jsp	Wildkin	Wildkin Horse Dreams Jumpstart Messenger Bag - Kids	1130498	1130498	36.99	12/2/2013 14:37	Wildkin Horse Dreams Jumpstart Messenger Bag - Kids	n/a	n/a	"<li > <a href=""#collection-content"" class=""active""> Product Details </a> </li> </ul> <div id=""collection-content""> <div class=""prod_description1""> <div class=""Bdescription""> <p>Two interior pockets and two pockets under the front flap of this Wildkin messenger bag keeps them organized for class. In beige.</p><p><strong>Product Features:</strong></p> <ul> <li>Moisture-resistant finish lines interior</li> <li>Padded shoulder strap adjusts to fit</li> <li>Exterior offers a durable 600-<a href=""javascript:launch('http://www.kohlscorporation.com/ecom/valueadded/Glossary.htm#denier')"">denier</a> construction</li> </ul> <p><strong>Product Details:</strong></p> <ul> <li>10""H x 15""W x 5""D</li> <li>Ages 8 years & up</li> <li>Polyester/nylon</li> <li>Buckles & Velcro-like closure</li> <li>Manufacturer's one-year limited warranty</li> <li>Model no. 54025</li> </ul> <p><em>Promotional offers available online at Kohls.com may vary from those offered in Kohl's stores.</em></p> </div> </div> </div>"	"Product Details Two interior pockets and two pockets under the front flap of this Wildkin messenger bag keeps them organized for class. In beige.Product Features: Moisture-resistant finish lines interior Padded shoulder strap adjusts to fit Exterior offers a durable 600-denier construction Product Details: 10""H x 15""W x 5""D Ages 8 years & up Polyester/nylon Buckles & Velcro-like closure Manufacturer's one-year limited warranty Model no. 54025 Promotional offers available online at Kohls.com may vary from those offered in Kohl's stores."	n/a	n/a	n/a	Moisture-resistant finish lines interior####Padded shoulder strap adjusts to fit####Exterior offers a durable 600-denier construction	http://media.kohls.com.edgesuite.net/is/image/kohls/1130498?wid=350&hei=350&op_sharpen=1	n/a	n/a	N	n/a	n/a	n/a	n/a	n/a	n/a	"</p> <ul> <li>10""H x 15""W x 5""D</li> <li>Ages 8 years & up</li> <li>Polyester/nylon</li> <li>Buckles & Velcro-like closure</li> <li>Manufacturer's one-year limited warranty</li> <li>Model no. 54025</li> </ul> <p><em>Promotional offers available online at Kohls.com may vary from those offered in Kohl's stores.</em></p>"	n/a	"10""H x 15""W x 5""D####Ages 8 years & up####Polyester/nylon####Buckles & Velcro-like closure####Manufacturer's one-year limited warranty####Model no. 54025 Promotional offers available online at Kohls.com may vary from those offered in Kohl's stores."	n/a	n/a	n/a	n/a	n/a	n/a	n/a	n/a	n/a	n/a	n/a	n/a	n/a	n/a	n/a	n/a	n/a	36.99	n/a	n/a	Yes	n/a	n/a	n/a	n/a	n/a	97277540254	n/a	n/a	n/a	n/a	n/a	n/a	n/a	n/a
LGK0194	n/a	Kohls	n/a	n/a	n/a	n/a	n/a	http://www.kohls.com/product/prd-1130497/wildkin-horse-jumpstart-messenger-bag-kids.jsp	Wildkin	Wildkin Horse Jumpstart Messenger Bag - Kids	1130497	1130497	36.99	12/2/2013 14:37	Wildkin Horse Jumpstart Messenger Bag - Kids	n/a	n/a	"<li > <a href=""#collection-content"" class=""active""> Product Details </a> </li> </ul> <div id=""collection-content""> <div class=""prod_description1""> <div class=""Bdescription""> <p>This Wildkin messenger bag has space for all her school supplies. Two interior pockets and two pockets under the front flap of this girls' messenger bag keep her organized for class. Complete with a playful horse print, this messenger bag has A+ style. In pink.</p><ul> <li>Moisture-resistant finish lines interior.</li> <li>Padded shoulder strap adjusts to fit.</li> <li>Exterior offers a durable 600-<a href=""javascript:launch('http://www.kohlscorporation.com/ecom/valueadded/Glossary.htm#denier')"">denier</a> construction.</li> <li>Details: <ul> <li>10""H x 15""W x 5""D</li> <li>Ages 8 years & up</li> <li>Polyester/nylon</li> <li>Buckles & Velcro-like closure</li> <li>Manufacturer's one-year limited warranty</li> <li>Model no. 54020</li> <li><em>Promotional offers available online at Kohls.com may vary from those offered in Kohl's stores.</em></li> </ul> </li> </ul> </div> </div> </div>"	"Product Details This Wildkin messenger bag has space for all her school supplies. Two interior pockets and two pockets under the front flap of this girls' messenger bag keep her organized for class. Complete with a playful horse print, this messenger bag has A+ style. In pink. Moisture-resistant finish lines interior. Padded shoulder strap adjusts to fit. Exterior offers a durable 600-denier construction. Details: 10""H x 15""W x 5""D Ages 8 years & up Polyester/nylon Buckles & Velcro-like closure Manufacturer's one-year limited warranty Model no. 54020 Promotional offers available online at Kohls.com may vary from those offered in Kohl's stores."	n/a	n/a	n/a	n/a	http://media.kohls.com.edgesuite.net/is/image/kohls/1130497?wid=350&hei=350&op_sharpen=1	n/a	n/a	N	n/a	n/a	n/a	n/a	n/a	n/a	n/a	n/a	n/a	n/a	n/a	n/a	n/a	n/a	n/a	n/a	n/a	n/a	n/a	n/a	n/a	n/a	n/a	n/a	n/a	n/a	36.99	n/a	n/a	Yes	n/a	n/a	n/a	n/a	n/a	97277540209	n/a	n/a	n/a	n/a	n/a	n/a	n/a	n/a
LGK0202	n/a	Kohls	n/a	n/a	n/a	n/a	n/a	http://www.kohls.com/product/prd-1130536/wildkin-kaleidoscope-crackerjack-backpack-kids.jsp?searchTerm=Wildkin%20Kaleidoscope%20Crackerjack%20Backpack	Wildkin	Wildkin Kaleidoscope Crackerjack Backpack - Kids	1130536	1130536	36.99	12/2/2013 14:37	Wildkin Kaleidoscope Crackerjack Backpack - Kids	n/a	n/a	"<li > <a href=""#collection-content"" class=""active""> Product Details </a> </li> </ul> <div id=""collection-content""> <div class=""prod_description1""> <div class=""Bdescription""> <p>From the roomy main compartment to the organizer front pocket with pouches and a pencil holder, this Wildkin girls' backpack is a school essential. In pink/multi.</p><p><strong>Product Features</strong></p> <ul> <li>Moisture-resistant lining</li> <li>Two side mesh pockets</li> <li>Adjustable, padded shoulder straps</li> <li>Shell features 600-<a href=""javascript:launch('http://www.kohlscorporation.com/ecom/valueadded/Glossary.htm#denier')"">denier</a> construction</li> </ul> <p><strong>Product Details</strong></p> <ul> <li>16""H x 12""W x 5""D</li> <li>Ages 3 years & up</li> <li>Polyester/nylon</li> <li>Zipper closures</li> <li>Manufacturer's one-year limited warranty</li> <li>Model no:<strong> </strong>57087</li> </ul> <p><em>Promotional offers available online at Kohls.com may vary from those offered in Kohl's stores.</em></p> </div> </div> </div>"	"Product Details From the roomy main compartment to the organizer front pocket with pouches and a pencil holder, this Wildkin girls' backpack is a school essential. In pink/multi.Product Features Moisture-resistant lining Two side mesh pockets Adjustable, padded shoulder straps Shell features 600-denier construction Product Details 16""H x 12""W x 5""D Ages 3 years & up Polyester/nylon Zipper closures Manufacturer's one-year limited warranty Model no: 57087 Promotional offers available online at Kohls.com may vary from those offered in Kohl's stores."	n/a	n/a	n/a	n/a	http://media.kohls.com.edgesuite.net/is/image/kohls/1130536?wid=350&hei=350&op_sharpen=1	n/a	n/a	N	n/a	n/a	n/a	n/a	n/a	n/a	n/a	n/a	n/a	n/a	n/a	n/a	n/a	n/a	n/a	n/a	n/a	n/a	n/a	n/a	n/a	n/a	n/a	n/a	n/a	n/a	36.99	n/a	n/a	Yes	n/a	n/a	n/a	n/a	n/a	97277570879	n/a	n/a	n/a	n/a	n/a	n/a	n/a	n/a
